{
  "id": "vessel-fill-pour",
  "name": "Vessel fill and pour",
  "status": "proposed",
  "source": { "type": "user-provided-reference", "description": "An inspected recipe animation pours liquids into a glass: a stream from a tilted bottle and a rising, tinting liquid level with measurement ticks.", "inspected": true, "inspected_on": "2026-10-30" },
  "technique": "A container fills as a pour stream connects bottle and liquid; the level rises against measurement ticks and the colour mixes with each ingredient, so quantities become visible.",
  "purpose": "Recipes, mixing, quantities and accumulation metaphors.",
  "visual_behaviour": "Bottle tilts about its neck, a stream draws down, the liquid level rises with a gently wavy surface and shifts colour, the stream retracts.",
  "mechanics": "Liquid as a wave path clipped by the vessel interior; level tween with ease-out; fill colour tween per ingredient; stream as a stroked path drawn then erased.",
  "decomposition": { "primitives": ["wave-surface", "clip-mask", "svg-path"], "effects": ["liquid-transition", "stroke-draw"], "timing": "About 1.5-2.5 s per pour." },
  "use_cases": ["recipe or how-to", "data accumulation", "mixing metaphor"],
  "failure_modes": ["Level overshooting the vessel", "Stream not touching the surface"],
  "implementation_state": "documented",
  "implemented_by": [],
  "implementation": { "approach": "Studio.draw.wave inside an SVG clipPath shaped like the vessel interior; level and fill tweens; Studio.draw.stroke / erase for the stream. Candidate Studio.fx.fill for the recipe templates (masala-chai project could use it)." },
  "capability": { "support": "native", "compatible_components": ["liquid-transition", "stroke-draw", "wave-surface"], "complexity": "medium", "resources": { "basis": "estimated", "cpu": "low" }, "additional_tooling": { "needed": "no" }, "priority": { "creative_value": 3, "cost": 2 } },
  "provenance": [ { "source_id": "ref-c3bc609841", "timestamps": [8.0, 12.0, 18.0], "observed": "Bottles tilt and pour; the glass fills and changes colour against side ticks (approx., from overview spacing)." } ],
  "related": { "techniques": ["step-progress-tracker", "single-stage-progression"], "effects": ["liquid-transition"] },
  "licensing_notes": "Technique only; the reference drink and its bottles are not reproduced.",
  "tags": ["recipe", "liquid", "fill", "pour", "how-to", "backlog", "reference-derived"],
  "metadata": { "author": "MotionLab", "created_at": "2026-10-30", "updated_at": "2026-10-30" }
}
