{
  "id": "continuous-line-spine",
  "name": "Continuous line as narrative spine",
  "status": "experimental",
  "source": { "type": "user-provided-reference", "description": "Three inspected references keep one line alive across scenes (a heartbeat trace that becomes the ground line of every scene, staff lines that become an underline, a swoosh that closes the piece).", "inspected": true, "inspected_on": "2026-10-30" },
  "technique": "One line persists or is redrawn across scene changes and changes role (heartbeat, horizon, path, underline), so a story of many scenes reads as one continuous thought.",
  "purpose": "Continuity and structure for multi-scene stories; a visual throughline that can open and close the piece.",
  "visual_behaviour": "A line drawn in the first scene stays in the same screen position through cuts while the scenery changes around it, then returns to its first form at the end.",
  "mechanics": "Line on a layer above the scenes (or at the same position in each scene) drawn with a pen-led stroke; scene cuts never cross the line's position.",
  "decomposition": { "primitives": ["svg-path"], "effects": ["pen-stroke", "stroke-draw"], "timing": "Whole piece; bookend draws of 1-2 s." },
  "parameters": [ { "name": "line role per scene", "description": "Which object the line becomes in each scene" } ],
  "use_cases": ["life or journey story", "brand film", "explainer with chapters", "title sequence"],
  "failure_modes": ["The line competes with scene content if it is too heavy", "Breaking position continuity at a cut loses the effect"],
  "implementation_state": "prototyped",
  "implemented_by": [],
  "implementation": { "approach": "Draw the spine with Studio.draw.pen on a full-frame SVG above the scenes (or the same path in each scene); scene changes happen around it. Demonstrated in tests/reference-derived/pen-and-bloom; no dedicated runtime API.", "runtime_api": ["Studio.draw.pen", "Studio.draw.layer"] },
  "capability": { "support": "native", "compatible_components": ["pen-stroke", "stroke-draw"], "complexity": "medium", "resources": { "basis": "estimated", "cpu": "low" }, "additional_tooling": { "needed": "no" }, "priority": { "creative_value": 4, "cost": 2, "note": "A composition principle; a reusable composition could follow once two projects use it." } },
  "provenance": [
    { "source_id": "ref-5924215625", "timestamps": [0.5, 8.0, 19.5], "observed": "A heartbeat trace becomes the ground line walked through every life stage and returns flat at the end." },
    { "source_id": "ref-49459ad8c1", "timestamps": [2.5, 8.5], "observed": "Lines drawn from the accent dot recur as staff lines and as the closing underline." },
    { "source_id": "ref-0bf0254a3d", "timestamps": [13.1], "observed": "A swoosh line closes the reel and retracts into a dot." }
  ],
  "validation": { "state": "preview", "evidence": [
    { "kind": "frame-review", "path": "tests/reference-derived/pen-and-bloom/qa/report.json", "result": "pass", "date": "2026-10-30", "notes": "Pen line, its dot and a later pen underline carry one thread across three scenes." }
  ] },
  "related": { "techniques": ["pen-led-stroke", "element-bloom-transition"], "templates": ["illustrated-explainer", "title-sequence"] },
  "licensing_notes": "Technique only, learned from user-supplied references (inspiration-only, rights unknown). Never reuse the reference stories or characters.",
  "tags": ["line-art", "continuity", "narrative", "structure", "reference-derived"],
  "metadata": { "author": "MotionLab", "created_at": "2026-10-30", "updated_at": "2026-10-30" }
}
